Type,Date
Shrinking UK economy highlights challenge for Jeremy Hunt,11.11.2022
UK billionaire’s family dispute laid bare by court rulings,11.11.2022
"UK governance reforms risk flight of capital from public markets, says regulator",11.11.2022
Cult Shop: Paris’s oldest chocolaterie,11.11.2022
"UK interest rates already higher than needed, says BoE policymaker",11.11.2022
The NHS is failing the nurses who keep it afloat,11.11.2022
London’s new lord mayor calls for creation of UK wealth fund,11.11.2022
Shortcuts: cycling across Antarctica and Battersea Power Station’s first hotel,11.11.2022
Hunt hits back at Kwarteng’s attempt to play down mini-Budget,11.11.2022
Jeremy Hunt leads chastened Conservatives back to ‘Treasury orthodoxy’,11.11.2022
"Angela Rayner: ‘Normally I say, “play the ball not the man”. But Boris was literally the ball and the man’",11.11.2022
Property downturn hits UK housebuilders as sales plummet,11.11.2022
FirstFT: Easing US inflation triggers relief rally,11.11.2022
Daimler Truck warns supply chain ‘broken’ despite easing chip shortage,11.11.2022
Childcare is broken: even a three-year-old could tell you,11.11.2022
"Delle Pietre, a perfect palazzo in the heart of Rome",11.11.2022
Women’s pains are still not being taken seriously,11.11.2022
Baillie Gifford’s Scottish Mortgage cuts China exposure,11.11.2022
UK economy shrinks in third quarter as recession looms,11.11.2022
"Cool inflation, giddy markets",11.11.2022
Lula deploys security forces after Bolsonaro video questions election result,16.01.2023
US green subsidies draw $2.5bn  solar investment from South Korea’s Hanwha,16.01.2023
German car industry calls for US-style green subsidies in Europe,16.01.2023
Egypt’s pound plunges to new low as authorities try to stem currency crisis,16.01.2023
Australian Cardinal George Pell dies at 81,16.01.2023
High and dry in Manhattan: buyers and sellers in housing market stand-off,16.01.2023
German village becomes climate flashpoint over ‘painful’ coal revival,16.01.2023
EU corruption probe explores Morocco links,16.01.2023
Brazil’s Congress riot: how Bolsonaro supporters stormed the capital,16.01.2023
Energy crisis and inflation help push Austrians towards far right,16.01.2023
The world in 2023,16.01.2023
Tracking Russia’s invasion of Ukraine in maps,16.01.2023
Global inflation tracker: see how your country compares on rising prices,16.01.2023
Bolsonaro plans return to Brazil as prosecutors seek to seize assets,16.01.2023
FAA lifts halt on domestic US flights after computer system restored,16.01.2023
War in Ukraine costs Moscow more than its record energy revenues,16.01.2023
Russian forces may have scored rare success in battle near Bakhmut,16.01.2023
"Fed will not become a ‘climate policymaker’, says Powell",16.01.2023
UK sets new record for wind generation thanks to blustery conditions,16.01.2023
Minister sets out ‘science superpower’ ambitions for UK,16.01.2023
Saudi Arabia launches mining fund in effort to reduce oil dependency,16.01.2023
Sharing economic pain is about equality not envy,16.01.2023
"More than 750,000 UK households at risk of mortgage default, says regulator",16.01.2023
Europe’s space ambitions are hobbled by funding structures,16.01.2023
Turkish court convicts medical expert on terror charges,16.01.2023
Copper rallies on hopes of China economic rebound,16.01.2023
Trafigura sells stake in Rosneft-backed refinery in India,16.01.2023
FAA lifts halt on domestic US flights after computer system restored,16.01.2023
The EU’s pioneering carbon border tax,16.01.2023
British politics is still suffering from ‘long populism’,16.01.2023
Sunak calls for ‘constructive dialogue’ with unions as strikes escalate,16.01.2023
Sweden plans new law to enable nuclear plant construction,16.01.2023
Lex newsletter: call this a winter of discontent?,16.01.2023
Are Britain’s striking public sector workers underpaid?,16.01.2023
FirstFT: Goldman employees await their fate,16.01.2023
India’s new railways project picks up speed,16.01.2023
Tracking Russia’s invasion of Ukraine in maps,16.01.2023
Australian solar project collapses after clash between billionaire backers,16.01.2023
Setting NHS minimum service rules poses a risk for Tories,16.01.2023
UK and Japan to sign defence pact to counter China threat,16.01.2023
"Live updates: UK plans to send tanks to Ukraine, Downing St says",16.01.2023
The China reopening trade,16.01.2023
Macron labours through test of his reform agenda as tougher trials loom,16.01.2023
