Type,Date
Polls close in Turkey as Erdoğan faces his sternest test,14.05.2023
Zelenskyy praises Germany’s €2.7bn military aid pledge to Ukraine,14.05.2023
G7 and EU to ban restart of Russian gas pipelines,14.05.2023
Militants agree ceasefire with Israel to end five days of fighting,14.05.2023
White House and Republicans start to shape debt ceiling deal,14.05.2023
Shipping groups press Chinese counterparts for sanctions-proof contracts,14.05.2023
Eurovision 2023 — Sweden’s Loreen wins nailbiter after Finland makes a late Cha-Cha-Charge,14.05.2023
Greece’s ‘greatest turnround’: from junk to investment grade,14.05.2023
How to end the US debt ceiling stand-off,14.05.2023
Erdoğan fights for survival with strategy of hope and fear,14.05.2023
Tracking Lady R: the covert voyage that allegedly took South African arms to Russia,14.05.2023
Turkish general election 2023,14.05.2023
Is this the end of the road for affirmative action?,14.05.2023
The harrowing true story of a high-stakes heist gone wrong,14.05.2023
Tracking Russia’s invasion of Ukraine in maps,14.05.2023
Global inflation tracker: see how your country compares on rising prices,14.05.2023
White House and Republicans start to shape debt ceiling deal,14.05.2023
G7 and EU to ban restart of Russian gas pipelines,14.05.2023
Greece’s ‘greatest turnround’: from junk to investment grade,14.05.2023
South Africa says it is in its ‘own interest’ to probe Russia arms claim,14.05.2023
Modi’s BJP concedes crucial state election in rare poll setback,14.05.2023
Turkish general election 2023,14.05.2023
The perils of economic forecasting in uncertain times,14.05.2023
Keir Starmer scales back plan to extend voting rights to EU citizens,14.05.2023
Will US retail sales rebound as inflation cools?,14.05.2023
How to fix Britain’s water industry,14.05.2023
Pressure grows on UK to stop ‘abusive litigation’ by oligarchs against critics,14.05.2023
Modi’s BJP concedes crucial state election in rare poll setback,14.05.2023
Japan pushes for strong pledges on tackling dementia from G7 allies,14.05.2023
Mastercard’s Europe head defends card fees amid UK regulatory probe,14.05.2023
Algorithms prop up the market as fretful humans sit out the uncertainty,14.05.2023
How Iran will profit from Shell’s Iraqi gas project,14.05.2023
DMG Mori tracks use of its machine tool products to prevent military application,14.05.2023
China’s EV industry braced for shakeout as prices plunge,14.05.2023
South Africa says it is in its ‘own interest’ to probe Russia arms claim,14.05.2023
Consumer goods groups face retailers’ resistance over higher prices,14.05.2023
Investors predict ‘imminent’ US high-yield bond sell off,14.05.2023
Adani Group seeks to issue shares for first time since short selling attack,14.05.2023
Belarus caught in the crossfire,14.05.2023
EU states back ban on destruction of unsold clothing,14.05.2023
Wildfires in forests of Canada and Russia put climate scientists on alert,14.05.2023
From the ancient Greeks to the White Lotus: a Sicilian road trip,14.05.2023
G7 finance ministers warn of ‘uncertainty’ on global economy,14.05.2023
Great British Rail: the case for tackling ticket price confusion,14.05.2023
Signs of the times: three graphic design tours of Zürich,14.05.2023
Letter from Mexico: a five-hour wine tasting full of surprises,14.05.2023
Germany does ‘180-degree turn’ in defence policy following Russian aggression,28.02.2022
Putin puts Russian nuclear forces on high alert as west steps up sanctions,28.02.2022
Russia struggles to take Kyiv and Kharkiv but pushes across Black Sea coast,28.02.2022
Efforts to supply weapons to Ukraine face multiple obstacles,28.02.2022
Russians search for cash as west imposes sanctions on banks,28.02.2022
Russian airlines face total ban from EU’s airspace,28.02.2022
Tracking Russia’s invasion of Ukraine in maps,28.02.2022
Putin underestimated Ukraine and the west,28.02.2022
‘A global financial pariah’: how central bank sanctions could hobble Russia,28.02.2022
List of sanctions imposed by the west against Russia over Ukraine invasion,28.02.2022
‘I just want to be safe’: Ukrainians fleeing the war converge on Lviv,28.02.2022
"Russia, Ukraine and the 30-year quest for a post-Soviet order",28.02.2022
What if Donald Trump were still president?,28.02.2022
What western Europe can do for Ukrainians,28.02.2022
French election polls: the race for the presidency,28.02.2022
"Fed’s expected policy will be ‘too little too late’ on inflation, economists fear",28.02.2022
"The new energy shock: Putin, Ukraine and the global economy",28.02.2022
Russia pours more troops into Ukraine after meeting heavy resistance,28.02.2022
West to impose sanctions on Russian central bank and cut some lenders from Swift,28.02.2022
Russia’s bid for rapid victory meets forceful Ukrainian response,28.02.2022
Don’t mention the invasion: China spins Russia’s war in Ukraine,28.02.2022
Zelensky urges Ukrainians to resist as Russian forces battle for Kyiv,28.02.2022
Russia’s FX reserves slip from its grasp,28.02.2022
FirstFT: Putin puts Russian nuclear forces on high alert,28.02.2022
Norway’s $1.3tn oil fund to ditch Russian investments,28.02.2022
West takes Putin’s nuclear threat seriously,28.02.2022
BP to divest stake in Russian state-oil company Rosneft,28.02.2022
McKinsey’s Ukraine boss calls out ‘criminal’ Russian government,28.02.2022
"Business left to resolve border delays, survey finds",28.02.2022
Key moments to come in this dark age of elected despots,28.02.2022
UK high streets bounce back from Covid curbs as London falters,28.02.2022
Vladimir Putin’s grand plan is unravelling,28.02.2022
"Ukraine war news from February 27: Moscow places nuclear forces on high alert, BP exits stake in Rosneft, Norwegian oil fund divests from Russia",28.02.2022
"China, Russia and the race to a post-dollar world",28.02.2022
The EU must deploy financial shock and awe against Putin’s aggression,28.02.2022
Donald Trump’s accounts may hold him to account,28.02.2022
Germany unveils ‘new era’ in defence policy with big military spending jump,28.02.2022
Northern Ireland seeks to fix longstanding productivity problem,28.02.2022
Sanctions: dithering EU willing to freeze Russian central bank — but not German homes,28.02.2022
Mikhail Fridman speaks out against Ukrainian conflict in letter to staff,28.02.2022
India seeks ‘Aramco moment’ with sale of stake in LIC,28.02.2022
Investors brace for flood of mortgage bonds when Fed trims balance sheet,28.02.2022
West to impose sanctions on Russian central bank and cut some lenders from Swift,28.02.2022
Ethiopia launches fund to lure billions of dollars in foreign investment,28.02.2022
Chip sanctions aim for Russia’s military and its tech industry hopes,28.02.2022
"US midterm elections: As Texas goes, so goes the nation?",28.02.2022
Inside Arik Levy and Zoé Ouvrier’s artistic idyll on the Côte d’Azur,28.02.2022
Ukraine calls off Mariupol evacuation and accuses Russia of violating ceasefire,09.03.2022
Military Briefing: Russia gains ground ahead of potential assault on Odesa,09.03.2022
China sets lowest growth target in 30 years as Ukraine fallout looms,09.03.2022
Russia condemned across world for ‘reckless’ nuclear plant attack,09.03.2022
Russia bans Facebook and restricts Twitter as it tightens grip on information,09.03.2022
Financial crimes watchdog puts UAE on ‘grey list’,09.03.2022
‘They are trying to exterminate us’: Mariupol comes under Russian onslaught,09.03.2022
How Ukraine tries to undercut Moscow’s censorship over Russian war victims,09.03.2022
Letter from Ukraine: the language of war,09.03.2022
The legal fallout from the Russia sanctions,09.03.2022
French election polls: the race for the presidency,09.03.2022
Tracking Russia’s invasion of Ukraine in maps,09.03.2022
Kyiv diary: ‘Was I right not to leave?’,09.03.2022
"Elvira Nabiullina, a technocrat plunged into chaos at Russia’s central bank",09.03.2022
Putin’s plan is failing in ways he could not have imagined,09.03.2022
South Korea’s raucous politics: presidential election defined by mudslinging and scandal,09.03.2022
French election polls: the race for the presidency,09.03.2022
US works with Poland to provide Ukraine with fighter jets,09.03.2022
Ukraine calls off Mariupol evacuation and accuses Russia of violating ceasefire,09.03.2022
Military Briefing: Russia gains ground ahead of potential assault on Odesa,09.03.2022
The ‘London laundromat’: will Britain wean itself off Russian money?,09.03.2022
Zelensky’s call for volunteers to defend Ukraine heeded by thousands from abroad,09.03.2022
Ukraine invasion nudges Germany towards new security mindset,09.03.2022
‘I’m not sure what’s in it’. UK steps up efforts to target unvaccinated,09.03.2022
Amazon under investor pressure over tax transparency,09.03.2022
Investors fret over default protection for Russian bonds,09.03.2022
US works with Poland to provide Ukraine with fighter jets,09.03.2022
Indian politicians brush off crime accusations in world’s largest democracy,09.03.2022
Visa and Mastercard suspend operations in Russia,09.03.2022
"Ukraine war news from March 5: Ukraine accuses Russia of violating Mariupol ceasefire, Putin warns west against no-fly zone",09.03.2022
Russia demands US guarantees over revival of Iran nuclear accord,09.03.2022
"Canada, US and UK move to strip Russian representative of IMF board title",09.03.2022
Shell stands to make $20mn from contentious Russian oil trade,09.03.2022
Britain must not ignore its obligations to vulnerable refugees,09.03.2022
Lawyers cut ties with Kremlin-linked clients as reputational risks mount,09.03.2022
Investors retreat from European stocks,09.03.2022
UK’s rift with EU begins to heal as war refocuses foreign policy,09.03.2022
‘Goldilocks’ jobs report keeps Fed on track for series of rate rises,09.03.2022
Companies struggle to extract staff from Ukraine and Russia,09.03.2022
SMBC Nikko executives arrested for alleged market manipulation,09.03.2022
Tracking Russia’s invasion of Ukraine in maps,09.03.2022
Australian cricket legend Shane Warne dies,09.03.2022
Superyachts: Russia’s oligarchs set sail for safer waters,09.03.2022
When global market bets went wrong,09.03.2022
Ukraine latest and tackling 'Londongrad',09.03.2022
"Elvira Nabiullina, a technocrat plunged into chaos at Russia’s central bank",09.03.2022
Putin’s plan is failing in ways he could not have imagined,09.03.2022
Jay Powell does little to dispel expectations of third big rate rise,08.09.2022
Steve Bannon indicted for alleged fundraising fraud,08.09.2022
ECB raises rates by 75 basis points and promises more to come,08.09.2022
Brussels aims to relax state aid rules to ease energy sector cash crunch,08.09.2022
Ukraine claims significant gains in counter-offensive against Russia,08.09.2022
Australia passes landmark legislation to cut carbon emissions,08.09.2022
Pandemic exposes sharp divide in European cancer treatment,08.09.2022
Macron convenes French ‘national council’ in bid to reboot second term,08.09.2022
Bolsonaro rallies supporters with show of military force,08.09.2022
‘A super-flood to beat all’: monsoon disaster piles misery on Pakistan,08.09.2022
The wartime economic interventions that risk losing the peace,08.09.2022
How history caught up with my Russian academic friends,08.09.2022
Putin propaganda just took an exceptionally strange turn,08.09.2022
Global inflation tracker: see how your country compares on rising prices,08.09.2022
Tracking Russia’s invasion of Ukraine in maps,08.09.2022
India and China undercut Russia’s oil sanctions pain,08.09.2022
ECB raises rates by 75 basis points and promises more to come,08.09.2022
Brainard calls for Fed to hold its nerve on inflation,08.09.2022
Ukraine claims significant gains in counter-offensive against Russia,08.09.2022
How do household energy bills compare across Europe?,08.09.2022
Queen Elizabeth II: a life in pictures,08.09.2022
Queen Elizabeth II dies,08.09.2022
King Charles III takes the throne,08.09.2022
Truss’s £150bn energy plan puts Bank of England on the spot,08.09.2022
A monarch who spoke for her kingdom,08.09.2022
Queen Elizabeth II: April 21 1926-September 8 2022,08.09.2022
"The grace, humanity and fortitude of Elizabeth II",08.09.2022
UK has to be honest about the cost of energy assistance,08.09.2022
Top Treasury civil servant sacked by Kwarteng,08.09.2022
Liz Truss’s expensive energy lifeline,08.09.2022
Eurozone bonds slide after ECB raises interest rates,08.09.2022
Energy producers extended £40bn ‘last resort’ liquidity facility,08.09.2022
NHS backlog for routine care hits record high of 6.8mn in England,08.09.2022
Ex-Scottish transport minister admits ‘catastrophic failures’ over ferry purchase,08.09.2022
Truss unleashes cash and unknowns with energy package,08.09.2022
Truss shows signs of a more pragmatic approach to the EU,08.09.2022
UK universities demand new funding model as inflation stretches budgets,08.09.2022
Energy crisis: Truss must bust the link between renewables and gas,08.09.2022
Liz Truss pledges fracking drive in England to boost energy security,08.09.2022
Naspers confirms move of Tencent shares to Hong Kong clearing system,08.09.2022
Spire rides wave of demand for private healthcare,08.09.2022
Brussels ignores derivatives at its peril amid energy crisis,08.09.2022
Businesses left in dark over UK’s energy rescue package,08.09.2022
Endless frictions with Brussels risk fuelling Euroscepticism in Poland,08.09.2022
Royal family rushes to Queen’s side amid concerns for her health,08.09.2022
"Ukraine and Russia making progress on grain talks, says UN",14.07.2022
Ukraine’s lightning advance near Kharkiv leaves Russian forces in disarray,11.09.2022
Russia threatens more strikes against Kyiv after loss of warship,15.04.2022
Biden feels the heat as US inflation hits 40-year high,14.07.2022
Canada surprises with 100bp interest rate rise,14.07.2022
Brussels urges EU to turn down heat to resist Russian gas curbs,14.07.2022
IMF set to make fresh downgrades to global growth,14.07.2022
EU court ruling expands Brussels’ powers to scrutinise tech mergers,14.07.2022
Joe Biden needs Saudi oil but must not ignore its human rights record,14.07.2022
Sri Lanka’s woes are a warning to other developing nations,14.07.2022
US inflation surge signals tough times ahead,14.07.2022
Hong Kong’s legacy — from Chris Patten’s Diaries to City on the Edge,14.07.2022
"No, the global economy is not breaking into geopolitical blocs",14.07.2022
The mystery of how quantitative tightening will affect markets,14.07.2022
"Shinzo Abe, influential Japanese prime minister, 1954-2022",14.07.2022
Global inflation tracker: see how your country compares on rising prices,14.07.2022
Tracking Russia’s invasion of Ukraine in maps,14.07.2022
Nato and EU sound alarm over risk of Ukraine weapons smuggling,14.07.2022
US inflation hits 9.1% as pressure grows on Federal Reserve,14.07.2022
Sunak and Mordaunt become frontrunners in Tory leadership race,14.07.2022
Canada surprises with 100bp interest rate rise,14.07.2022
Bill Gates donates another $20bn to his charitable foundation,14.07.2022
Four of Hong Kong’s best places for char siu,14.07.2022
Live news updates: Panasonic to build $4bn battery plant in Kansas to meet Tesla demand,14.07.2022
Libya’s PM pushes for new chief of state oil company,14.07.2022
FirstFT: Sri Lanka’s president flees to the Maldives,14.07.2022
Sunak and Mordaunt become frontrunners in Tory leadership race,14.07.2022
US inflation hits 9.1% as pressure grows on Federal Reserve,14.07.2022
Tory leadership campaign turns ugly as Mordaunt finds grassroots appeal,14.07.2022
Trafigura sells stake in Putin-backed oil project to obscure HK trading outfit,14.07.2022
UK steelmakers outraged at plan to ease anti-dumping measures on China,14.07.2022
Tory leadership election tracker,14.07.2022
"MI5 needs more funds to combat rightwing terrorism in UK, say MPs",14.07.2022
Hear that? That’s the sound of 100 basis points,14.07.2022
Spanish banks: populist hopes to tap into higher bank profits,14.07.2022
UK ministers to tear up post-Brexit trade deal,14.07.2022
UK rail workers to strike on July 27 after rejecting ‘paltry’ pay offer,14.07.2022
Five British energy suppliers threatened with fines over direct debit rises,14.07.2022
EU moves to play down tensions over Kaliningrad,14.07.2022
Conservatives must rediscover their instinctive pragmatism,14.07.2022
"UK’s largest supplier of water to businesses receives 8,000 complaints",14.07.2022
Hong Kong IPOs: lithium giant’s disappointing listing spells trouble,14.07.2022
Allies sound alarm over plight of Ukraine’s public finances,14.07.2022
Mordaunt launches campaign as battle to be UK’s next PM enters voting stage,14.07.2022
Save for retirement or just put it all on red?,14.07.2022
UK regulator opens probe into groups including BT and Sky over sports broadcasts,14.07.2022
FirstFT: Twitter sues Musk,14.07.2022
US warns of sanctions for buyers that flout price cap on Russian oil,11.09.2022
Fed governor backs ‘significant increase’ in benchmark rate,11.09.2022
EU ministers back gas price cap and windfall levy on power companies,11.09.2022
Ukraine appeals for $17bn emergency fund as winter looms,11.09.2022
Five EU states vow to introduce minimum corporate tax,11.09.2022
EU sounds ‘full mobilisation’ after Kremlin shuts pipeline,11.09.2022
California heatwave exposes limits of climate plans,11.09.2022
‘We’re playing with fire’: the Ukrainian nuclear plant held hostage by Russia,11.09.2022
"Americans, long besotted by royalty, mourn Britain’s Queen",11.09.2022
High gas prices help Gazprom compensate for supply cuts,11.09.2022
Can a Nazi holiday resort reinvent itself as a 21st-century beach retreat?,11.09.2022
India seen through the eyes of its young women,11.09.2022
Global inflation tracker: see how your country compares on rising prices,11.09.2022
Tracking Russia’s invasion of Ukraine in maps,11.09.2022
Ukraine’s lightning advance near Kharkiv leaves Russian forces in disarray,11.09.2022
Lightning Ukraine offensive pushes Russia back 70km in a week,11.09.2022
EU sounds ‘full mobilisation’ after Kremlin shuts pipeline,11.09.2022
Scientists discover how air pollution causes lung cancer,11.09.2022
India and China undercut Russia’s oil sanctions pain,11.09.2022
Ukraine refugees: employment rights ease the fiscal strain,11.09.2022
China makes more than $30bn in emergency loans,11.09.2022
At home with Lara Stone,11.09.2022
Japan is preparing for a videogaming jamboree,11.09.2022
Electric vehicles will have to wait for the solid-state battery ‘game-changer’,11.09.2022
The death of the Queen: what happens next?,11.09.2022
Charles III proclaimed king in ceremony televised for first time,11.09.2022
Lightning Ukraine offensive pushes Russia back 70km in a week,11.09.2022
King Charles III in his own words,11.09.2022
Designer Alexandra Golovanoff’s guide to Paris,11.09.2022
Truss accused of ‘ideological purge’ in sacking of top civil servant,11.09.2022
"King Charles promises to serve ‘with loyalty, respect and love’",11.09.2022
"King Charles III promises to serve with ‘loyalty, respect and love’",11.09.2022
"‘Huge’ effort needed to lower energy bills, says ScottishPower chief",11.09.2022
Energy bills inflated by failure to implement EU power cables deal,11.09.2022
Jamie Ritblat’s employee trust paid £400 to settle tax claim. Now HMRC wants millions more,11.09.2022
"King Charles III, a life-long apprentice steps into the spotlight",11.09.2022
The Queen was an important reminder of a less cynical age,11.09.2022
Britain’s mid-Atlantic way on race,11.09.2022
Builders and estate agents braced for UK housing downturn,11.09.2022
Britain enters the era of King Charles III,11.09.2022
‘She’s all we’ve ever known’: UK reacts to life without its Queen,11.09.2022
Queen Elizabeth II: inside the royal finances,11.09.2022
Tributes to Queen in Scotland mask uncertain political undercurrent,11.09.2022
"UK energy package will weigh on gilts and pound, analysts warn",11.09.2022
Macron urges EU-wide executive pay curbs in campaign battle with Le Pen,15.04.2022
China cuts banks’ reserve rules in effort to combat economic impact of Covid,15.04.2022
Steinway IPO seeks to catch the ear of the world’s biggest piano market,15.04.2022
Russian trucks stuck in long queues to leave Poland as EU ban deadline looms,15.04.2022
Russia says warship Moskva has sunk in the Black Sea,15.04.2022
Finland and Sweden seek the security of Nato’s embrace,15.04.2022
Marine Le Pen exploits cost of living fears as French run-off vote looms,15.04.2022
Russia’s war should accelerate the green transition,15.04.2022
Ukraine battles to protect its churches and heritage from ravages of war,15.04.2022
Why the US has hit some Russian oligarchs with sanctions but not others,15.04.2022
Macron vs Le Pen: Latest polls for the French presidential election,15.04.2022
Tracking Russia’s invasion of Ukraine in maps,15.04.2022
The pervasive succession crisis threatening Japan’s economy,15.04.2022
Natalia Sindeyeva: Russia’s unlikely media revolutionary,15.04.2022
The Chinese companies trying to buy strategic islands,15.04.2022
Long Covid: the invisible public health crisis fuelling labour shortages,15.04.2022
Russia says warship Moskva has sunk in the Black Sea,15.04.2022
Russia warns of nuclear expansion in Baltics if Finland and Sweden join Nato,15.04.2022
Shanghai residents and police clash after homes seized for Covid quarantine,15.04.2022
Ofgem warns UK energy suppliers over unjustified increases in direct debits,15.04.2022
UK strikes deal to transport asylum seekers to Rwanda,15.04.2022
"Putin, Ukraine and the revival of the west",15.04.2022
Boris Johnson faces prospect of vote over misleading parliament on ‘partygate’,15.04.2022
A presidential election that has revealed a fractured France,15.04.2022
Britain is shamed by its treatment of refugees,15.04.2022
UK deportation plan puts Rwanda’s treatment of refugees back in focus,15.04.2022
Israeli security forces and Palestinian worshippers clash in Jerusalem,15.04.2022
Biden nominates former US Treasury official to lead Fed regulation,15.04.2022
Ditching a prime minister in time of war has well-founded precedents,15.04.2022
Investors’ voices are missing in corporate flight from Russia,15.04.2022
It is time to relearn the painful inflation lessons of the 1970s,15.04.2022
FirstFT: Elon Musk promises ‘plan B’ if hostile bid for Twitter fails,15.04.2022
Euro hits two-year low on ECB interest rates caution,15.04.2022
Latin America’s post-pandemic recovery looks browner than expected,15.04.2022
Rishi Sunak’s tax row and why it’s hard to put a politician off politics,15.04.2022
Joe Biden’s genocide comments escalate rhetoric against Russia,15.04.2022
Macron vs Le Pen: Latest polls for the French presidential election,15.04.2022
Tracking Russia’s invasion of Ukraine in maps,15.04.2022
South Korea downgrades Covid to a ‘Class 2’ disease and removes restrictions,15.04.2022
Shanghai residents and police clash after homes seized for Covid quarantine,15.04.2022
Slowing growth to the rescue,15.04.2022
Natalia Sindeyeva: Russia’s unlikely media revolutionary,15.04.2022
US corporate bond trades fail as banks avoid Russia links,15.04.2022
"House prices to fall? Definitely, but not quite yet",15.04.2022
Young Instagram users in UK face surge in impersonation scams,15.04.2022
Planting trees in Scotland will not fix climate change,15.04.2022
Ukrainian forces advance into Kherson after Russia retreats,11.11.2022
Sweden says Nato membership talks with Turkey are ‘going very well’,16.01.2023
Brussels warns of EU recession as German output slides,11.11.2022
Biden travels to COP27 to ‘showcase’ US leadership on climate,11.11.2022
China cuts Covid quarantine rules while Guangzhou nears lockdown,11.11.2022
US warns Europe a conflict over Taiwan could cause global economic shock,11.11.2022
Biden and Xi to hold first in-person summit ahead of G20,11.11.2022
Ron vs Don: the Republican battle for 2024 has already begun,11.11.2022
How the youth vote helped the Democrats avert an election rout,11.11.2022
The drone war in Ukraine,11.11.2022
Borders are holding the world’s eight billion people back,11.11.2022
Why the media got it wrong again,11.11.2022
‘One long day in hell’: Ukrainian PoWs recall desperate fight for Mariupol,11.11.2022
Global inflation tracker: see how your country compares on rising prices,11.11.2022
I spent 10 days in a secret Chinese Covid detention centre,11.11.2022
Tracking Russia’s invasion of Ukraine in maps,11.11.2022
Trump and Murdoch’s marriage of convenience breaks down after US midterms,11.11.2022
Live results map: US midterm elections 2022,11.11.2022
Military briefing: how Russia’s Kherson retreat changes Ukraine war,11.11.2022
US warns Europe a conflict over Taiwan could cause global economic shock,11.11.2022
Ukrainian forces advance into Kherson after Russia retreats,11.11.2022
Former security guard at British embassy in Berlin admits spying for Russia,11.11.2022
UK culture chief hits back at criticism to move arts funding out of London,11.11.2022
Chancellor urged to help small UK businesses in Autumn Statement,11.11.2022
Biden’s flying visit to COP27 disappoints developing nations,11.11.2022
No more sausages: how a financial dispute brought down a City institution,11.11.2022
